{
  "schemaVersion": 1,
  "scope": "program",
  "sources": {
    "source-d0a18cb580": {
      "title": "入試実施状況について＜修士課程＞",
      "url": "https://www.k.u-tokyo.ac.jp/assets/files/2026result_mc.pdf",
      "type": "official",
      "confidence": "high",
      "checkedAt": "2026-10-13",
      "evidenceLocator": "PDF 1頁／令和4～7年度列、海洋技術環境学専攻行"
    },
    "official-frontier-2026": {
      "title": "入試実施状況について＜修士課程＞（令和4～8年度）",
      "url": "https://www.k.u-tokyo.ac.jp/assets/files/2027result_mc.pdf",
      "type": "official",
      "confidence": "high",
      "checkedAt": "2026-10-13",
      "evidenceLocator": "PDF 1頁／令和8年度列、海洋技術環境学専攻行",
      "notes": "ファイル名の2027は入学年度ではない。表内の令和8年度を2026年度として収録。括弧内外国人数は内数。"
    }
  },
  "series": [
    {
      "id": "series-10c177b47aa1",
      "label": "海洋技術環境学専攻 · 全年合計 · 全类别合计",
      "sourceType": "official",
      "confidence": "high",
      "degree": "master",
      "period": "annual",
      "selection": "全类别合计",
      "points": [
        {
          "admissionYear": 2022,
          "capacity": 18,
          "applicants": 63,
          "examinees": null,
          "admitted": 27,
          "enrolled": null,
          "reportedRatio": null,
          "sourceIds": [
            "source-d0a18cb580"
          ],
          "notes": "専攻単位。括弧内外国人数は内数。；原始考试期：全年合计（入試日程Bの翌10月入学希望者を含む）；证据定位：PDF 1頁、令和4～7年度の該当専攻行"
        },
        {
          "admissionYear": 2023,
          "capacity": 18,
          "applicants": 62,
          "examinees": null,
          "admitted": 30,
          "enrolled": null,
          "reportedRatio": null,
          "sourceIds": [
            "source-d0a18cb580"
          ],
          "notes": "専攻単位。括弧内外国人数は内数。；原始考试期：全年合计（入試日程Bの翌10月入学希望者を含む）；证据定位：PDF 1頁、令和4～7年度の該当専攻行"
        },
        {
          "admissionYear": 2024,
          "capacity": 18,
          "applicants": 55,
          "examinees": null,
          "admitted": 27,
          "enrolled": null,
          "reportedRatio": null,
          "sourceIds": [
            "source-d0a18cb580"
          ],
          "notes": "専攻単位。括弧内外国人数は内数。；原始考试期：全年合计（入試日程Bの翌10月入学希望者を含む）；证据定位：PDF 1頁、令和4～7年度の該当専攻行"
        },
        {
          "admissionYear": 2025,
          "capacity": 18,
          "applicants": 48,
          "examinees": null,
          "admitted": 23,
          "enrolled": null,
          "reportedRatio": null,
          "sourceIds": [
            "source-d0a18cb580"
          ],
          "notes": "専攻単位。括弧内外国人数は内数。；原始考试期：全年合计（入試日程Bの翌10月入学希望者を含む）；证据定位：PDF 1頁、令和4～7年度の該当専攻行"
        },
        {
          "admissionYear": 2026,
          "capacity": 18,
          "applicants": 61,
          "examinees": null,
          "admitted": 27,
          "enrolled": null,
          "reportedRatio": null,
          "sourceIds": [
            "official-frontier-2026"
          ],
          "notes": "当該専攻の行。括弧内外国人数は内数。出願者・最終合格者には入試日程Bの翌10月入学希望者を含む。受験者数・入学者数は非掲載。"
        }
      ]
    }
  ]
}
