{
  "schemaVersion": 1,
  "scope": "program",
  "sources": {
    "source-0baa4502f0": {
      "title": "2021年4月入学及び2020年9月入学 東京工業大学大学院修士課程・専門職学位課程入学試験結果",
      "url": "https://admissions.isct.ac.jp/plugins/cms/component_download_file.php?type=1&pageId=3284&contentsId=&contentsDataId=&prevId=&key=e42841d48fc163cd692dfc8f1999f1fb.pdf&fileName=2021-record-master-g5idv",
      "type": "official",
      "confidence": "high",
      "checkedAt": "2026-10-13",
      "evidenceLocator": "PDF 1頁「系別」表／材料系行／志願者数・合格者数欄"
    },
    "source-2713a63dec": {
      "title": "2025年4月入学及び2024年10月入学 東京科学大学大学院修士課程・専門職学位課程入学試験結果",
      "url": "https://admissions.isct.ac.jp/plugins/cms/component_download_file.php?type=1&pageId=3284&contentsId=&contentsDataId=&prevId=&key=1979f44af77a333920a218d33708f65f.pdf&fileName=2025_record_master",
      "type": "official",
      "confidence": "high",
      "checkedAt": "2026-10-13",
      "evidenceLocator": "PDF 1頁「系別」表／材料系行／志願者数・合格者数欄"
    },
    "source-2cb961f4d3": {
      "title": "2020年4月入学及び2019年9月入学 東京工業大学大学院修士課程・専門職学位課程入学試験結果",
      "url": "https://admissions.isct.ac.jp/plugins/cms/component_download_file.php?type=1&pageId=3284&contentsId=&contentsDataId=&prevId=&key=643e24355c4440209d15e5ed737ffb24.pdf&fileName=98-2020-record-master-1e9re",
      "type": "official",
      "confidence": "high",
      "checkedAt": "2026-10-13",
      "evidenceLocator": "PDF 1頁「系別」表／材料系行／志願者数・合格者数欄"
    },
    "source-43740d031d": {
      "title": "2023年4月入学及び2022年9月入学 東京工業大学大学院修士課程・専門職学位課程入学試験結果",
      "url": "https://admissions.isct.ac.jp/plugins/cms/component_download_file.php?type=1&pageId=3284&contentsId=&contentsDataId=&prevId=&key=0914b77db81b3542775f9d0e000fe324.pdf&fileName=2023-record-master",
      "type": "official",
      "confidence": "high",
      "checkedAt": "2026-10-13",
      "evidenceLocator": "PDF 1頁「系別」表／材料系行／志願者数・合格者数欄"
    },
    "source-5182d140db": {
      "title": "平成30年4月入学及び平成29年9月入学 東京工業大学大学院修士課程・専門職学位課程入学試験結果",
      "url": "https://admissions.isct.ac.jp/plugins/cms/component_download_file.php?type=1&pageId=3284&contentsId=&contentsDataId=&prevId=&key=1a42c858c0f44398e19f1fec94381a06.pdf&fileName=98-h30-record-master",
      "type": "official",
      "confidence": "high",
      "checkedAt": "2026-10-13",
      "evidenceLocator": "PDF 1頁「系別」表／材料系行／志願者数・合格者数欄"
    },
    "source-62f790b045": {
      "title": "2022年4月入学及び2021年9月入学 東京工業大学大学院修士課程・専門職学位課程入学試験結果",
      "url": "https://admissions.isct.ac.jp/plugins/cms/component_download_file.php?type=1&pageId=3284&contentsId=&contentsDataId=&prevId=&key=3ad124a02a5347cbb0919b7c2be26429.pdf&fileName=2022-record-master",
      "type": "official",
      "confidence": "high",
      "checkedAt": "2026-10-13",
      "evidenceLocator": "PDF 1頁「系別」表／材料系行／志願者数・合格者数欄"
    },
    "source-7411ae1941": {
      "title": "2026年4月入学及び2025年9月入学 東京科学大学大学院修士課程・専門職学位課程入学試験結果",
      "url": "https://admissions.isct.ac.jp/plugins/cms/component_download_file.php?type=1&pageId=3284&contentsId=&contentsDataId=&prevId=&key=0c69e351f20cc256afe09e0b7ebebad3.pdf&fileName=2026_record_master",
      "type": "official",
      "confidence": "high",
      "checkedAt": "2026-10-13",
      "evidenceLocator": "PDF 1頁「系別」表／材料系行／志願者数・合格者数欄"
    },
    "source-ba987e2dcc": {
      "title": "平成29年4月入学及び平成28年9月入学 東京工業大学大学院修士課程・専門職学位課程入学試験結果",
      "url": "https://admissions.isct.ac.jp/plugins/cms/component_download_file.php?type=1&pageId=3284&contentsId=&contentsDataId=&prevId=&key=b3475aa51acdf2c325f23a029542af86.pdf&fileName=98-h29-record-master431532",
      "type": "official",
      "confidence": "high",
      "checkedAt": "2026-10-13",
      "evidenceLocator": "PDF 1頁「系別」表／材料系行／志願者数・合格者数欄"
    },
    "source-bb88a64b82": {
      "title": "平成31年4月入学及び平成30年9月入学 東京工業大学大学院修士課程・専門職学位課程入学試験結果",
      "url": "https://admissions.isct.ac.jp/plugins/cms/component_download_file.php?type=1&pageId=3284&contentsId=&contentsDataId=&prevId=&key=349b37d9086bebed37181285f8f24c49.pdf&fileName=98-h31-record-master",
      "type": "official",
      "confidence": "high",
      "checkedAt": "2026-10-13",
      "evidenceLocator": "PDF 1頁「系別」表／材料系行／志願者数・合格者数欄"
    },
    "source-f616c57cc1": {
      "title": "2024年4月入学及び2023年9月入学 東京工業大学大学院修士課程・専門職学位課程入学試験結果",
      "url": "https://admissions.isct.ac.jp/plugins/cms/component_download_file.php?type=1&pageId=3284&contentsId=&contentsDataId=&prevId=&key=80aae100542c14d36feb80b99602edd5.pdf&fileName=2024_record_master",
      "type": "official",
      "confidence": "high",
      "checkedAt": "2026-10-13",
      "evidenceLocator": "PDF 1頁「系別」表／材料系行／志願者数・合格者数欄"
    }
  },
  "series": [
    {
      "id": "series-c1324b91de6b",
      "label": "材料系 · 全年合計 · 系別公表値（特別選考等の除外あり）",
      "sourceType": "official",
      "confidence": "high",
      "degree": "master",
      "period": "annual",
      "selection": "系別公表値（特別選考等の除外あり）",
      "points": [
        {
          "admissionYear": 2017,
          "capacity": null,
          "applicants": 268,
          "examinees": null,
          "admitted": 202,
          "enrolled": null,
          "reportedRatio": null,
          "sourceIds": [
            "source-ba987e2dcc"
          ],
          "notes": "学院合計ではなく、当該「系」の行。；PDF注記により、清華大学との合同プログラム、国際大学院プログラム、修士外国人留学生特別選考、技術経営におけるデュアルディグリープログラムの数は含まない。受験者数・入学者数・系別定員は非掲載。；原始考试期：平成29年4月入学・平成28年9月入学合計；证据定位：PDF p.1「系別」表／材料系行"
        },
        {
          "admissionYear": 2018,
          "capacity": null,
          "applicants": 255,
          "examinees": null,
          "admitted": 205,
          "enrolled": null,
          "reportedRatio": null,
          "sourceIds": [
            "source-5182d140db"
          ],
          "notes": "学院合計ではなく、当該「系」の行。；PDF注記により、清華大学との合同プログラム、国際大学院プログラム、修士外国人留学生特別選考、技術経営におけるデュアルディグリープログラムの数は含まない。受験者数・入学者数・系別定員は非掲載。；原始考试期：平成30年4月入学・平成29年9月入学合計；证据定位：PDF p.1「系別」表／材料系行"
        },
        {
          "admissionYear": 2019,
          "capacity": null,
          "applicants": 260,
          "examinees": null,
          "admitted": 205,
          "enrolled": null,
          "reportedRatio": null,
          "sourceIds": [
            "source-bb88a64b82"
          ],
          "notes": "学院合計ではなく、当該「系」の行。；PDF注記により、清華大学との合同プログラム、国際大学院プログラム、修士外国人留学生特別選考、技術経営におけるデュアルディグリープログラムの数は含まない。受験者数・入学者数・系別定員は非掲載。；原始考试期：平成31年4月入学・平成30年9月入学合計；证据定位：PDF p.1「系別」表／材料系行"
        },
        {
          "admissionYear": 2020,
          "capacity": null,
          "applicants": 245,
          "examinees": null,
          "admitted": 206,
          "enrolled": null,
          "reportedRatio": null,
          "sourceIds": [
            "source-2cb961f4d3"
          ],
          "notes": "学院合計ではなく、当該「系」の行。；PDF注記により、清華大学との合同プログラム、国際大学院プログラム、修士外国人留学生特別選考、技術経営におけるデュアルディグリープログラムの数は含まない。受験者数・入学者数・系別定員は非掲載。；原始考试期：2020年4月入学・2019年9月入学合計；证据定位：PDF p.1「系別」表／材料系行"
        },
        {
          "admissionYear": 2021,
          "capacity": null,
          "applicants": 206,
          "examinees": null,
          "admitted": 198,
          "enrolled": null,
          "reportedRatio": null,
          "sourceIds": [
            "source-0baa4502f0"
          ],
          "notes": "学院合計ではなく、当該「系」の行。；PDF注記により、清華大学との合同プログラム、国際大学院プログラム、修士外国人留学生特別選考、技術経営におけるデュアルディグリープログラムの数は含まない。受験者数・入学者数・系別定員は非掲載。；原始考试期：2021年4月入学・2020年9月入学合計；证据定位：PDF p.1「系別」表／材料系行"
        },
        {
          "admissionYear": 2022,
          "capacity": null,
          "applicants": 220,
          "examinees": null,
          "admitted": 202,
          "enrolled": null,
          "reportedRatio": null,
          "sourceIds": [
            "source-62f790b045"
          ],
          "notes": "学院合計ではなく、当該「系」の行。；PDF注記により、清華大学大学院合同プログラム、国際大学院プログラム、外国人留学生特別選考、技術経営専門職学位課程とのデュアルディグリープログラム等は含まない。受験者数・入学者数・系別定員は非掲載。；原始考试期：2022年4月・2021年9月入学合計；证据定位：PDF p.1「系別」表／材料系行"
        },
        {
          "admissionYear": 2023,
          "capacity": null,
          "applicants": 274,
          "examinees": null,
          "admitted": 203,
          "enrolled": null,
          "reportedRatio": null,
          "sourceIds": [
            "source-43740d031d"
          ],
          "notes": "学院合計ではなく、当該「系」の行。；PDF注記により、清華大学大学院合同プログラム、国際大学院プログラム、外国人留学生特別選考、技術経営専門職学位課程とのデュアルディグリープログラム等は含まない。受験者数・入学者数・系別定員は非掲載。；原始考试期：2023年4月・2022年9月入学合計；证据定位：PDF p.1「系別」表／材料系行"
        },
        {
          "admissionYear": 2024,
          "capacity": null,
          "applicants": 266,
          "examinees": null,
          "admitted": 205,
          "enrolled": null,
          "reportedRatio": null,
          "sourceIds": [
            "source-f616c57cc1"
          ],
          "notes": "学院合計ではなく、当該「系」の行。；PDF注記により、清華大学大学院合同プログラム、国際大学院プログラム、外国人留学生特別選考、技術経営専門職学位課程とのデュアルディグリープログラム等は含まない。受験者数・入学者数・系別定員は非掲載。；原始考试期：2024年4月・2023年9月入学合計；证据定位：PDF p.1「系別」表／材料系行"
        },
        {
          "admissionYear": 2025,
          "capacity": null,
          "applicants": 249,
          "examinees": null,
          "admitted": 208,
          "enrolled": null,
          "reportedRatio": null,
          "sourceIds": [
            "source-2713a63dec"
          ],
          "notes": "学院合計ではなく、当該「系」の行。；PDF注記により、清華大学大学院合同プログラム、国際大学院プログラム、外国人留学生特別選考、技術経営専門職学位課程とのデュアルディグリープログラム等は含まない。受験者数・入学者数・系別定員は非掲載。；原始考试期：2025年4月・2024年10月入学合計；证据定位：PDF p.1「系別」表／材料系行"
        },
        {
          "admissionYear": 2026,
          "capacity": null,
          "applicants": 241,
          "examinees": null,
          "admitted": 211,
          "enrolled": null,
          "reportedRatio": null,
          "sourceIds": [
            "source-7411ae1941"
          ],
          "notes": "学院合計ではなく、当該「系」の行。；PDF注記により、清華大学大学院合同プログラム、国際大学院プログラム、外国人留学生特別選考、技術経営専門職学位課程とのデュアルディグリープログラム等は含まない。受験者数・入学者数・系別定員は非掲載。；原始考试期：2026年4月・2025年9月入学合計；证据定位：PDF p.1「系別」表／材料系行"
        }
      ]
    }
  ]
}
