{
  "schemaVersion": 1,
  "scope": "graduate_school_total",
  "sources": {
    "source-8b2b7b1468": {
      "title": "2024年度 大学院入学状況（2024年4月入学）",
      "url": "https://www.osaka-u.ac.jp/++api++/ja/admissions/files/202404_daigakuin.pdf/@@download/file?expand=translations",
      "type": "official",
      "confidence": "high",
      "checkedAt": "2026-10-13",
      "evidenceLocator": "PDF 1頁左上「大学院博士前期課程（MC）」工学研究科行の総数（括弧内の内数は加算しない）"
    },
    "official-april-2026": {
      "title": "2026年度 大学院入学試験実施状況（2026年4月入学）",
      "url": "https://www.osaka-u.ac.jp/ja/admissions/graduate/files/202604-daigakuin.pdf/@@download/file",
      "type": "official",
      "confidence": "high",
      "checkedAt": "2026-10-13",
      "evidenceLocator": "PDF 1頁左上「大学院博士前期課程（MC）」工学研究科行。令和8年4月1日現在。"
    },
    "official-april-2025": {
      "title": "2025年度 大学院入学試験実施状況（2025年4月入学）",
      "url": "https://www.osaka-u.ac.jp/ja/admissions/graduate/files/202504-daigakuin.pdf/@@download/file",
      "type": "official",
      "confidence": "high",
      "checkedAt": "2026-10-13",
      "evidenceLocator": "PDF 1頁左上「大学院博士前期課程（MC）」工学研究科行。令和7年4月1日現在。",
      "notes": "括弧内は女子、角括弧内は外国人留学生として出願した者の内数。研究科の総数に重ねて加算しない。"
    }
  },
  "series": [
    {
      "id": "series-8e129e589758",
      "label": "工学研究科 · 4月入学 · 全类别合计",
      "sourceType": "official",
      "confidence": "high",
      "degree": "master",
      "period": "april_admission",
      "selection": "全类别合计",
      "points": [
        {
          "admissionYear": 2024,
          "capacity": 811,
          "applicants": 982,
          "examinees": 950,
          "admitted": 858,
          "enrolled": 813,
          "reportedRatio": null,
          "sourceIds": [
            "source-8b2b7b1468"
          ],
          "notes": "研究科合計。個別専攻・講座・入試区分には配分不可。；プロジェクト内の専攻級データがない場合の難易度背景としてのみ使用。；原始考试期：4月入学；证据定位：PDF「大学院入学状況」該当研究科行"
        },
        {
          "admissionYear": 2025,
          "capacity": 811,
          "applicants": 993,
          "examinees": 952,
          "admitted": 853,
          "enrolled": 800,
          "reportedRatio": null,
          "sourceIds": [
            "official-april-2025"
          ],
          "notes": "研究科全体の2025年4月入学集計。夏季一般選抜のみの値ではない。；（ ）内の女子、［ ］内の外国人留学生は内数として総数に含まれる。；原始考试期：4月入学；证据定位：PDF 1頁左上「大学院博士前期課程（MC）」工学研究科行（令和7年4月1日現在）"
        },
        {
          "admissionYear": 2026,
          "capacity": 811,
          "applicants": 1049,
          "examinees": 1002,
          "admitted": 869,
          "enrolled": 823,
          "reportedRatio": null,
          "sourceIds": [
            "official-april-2026"
          ],
          "notes": "研究科全体の2026年4月入学・全選抜区分合計。夏季一般選抜単独の人数ではなく、個別専攻には配分できない。括弧内は女子・外国人留学生の内数。"
        }
      ]
    }
  ]
}
